{
  "title": "EXAMLOCK Mock Paper",
  "language_pair": [
    "English",
    "Marathi"
  ],
  "version": "draft-1",
  "status": "DRAFT_FOR_HUMAN_MARATHI_REVIEW",
  "total_questions": 40,
  "parameterizable_question_count": 14,
  "parameterizable_fraction": 0.35,
  "instructions": {
    "en": "Choose one answer for each question. Each question carries one mark. This is fictional demonstration material, not an official examination.",
    "mr": "प्रत्येक प्रश्नासाठी एक योग्य पर्याय निवडा. प्रत्येक प्रश्नाला एक गुण आहे. हे केवळ प्रात्यक्षिकासाठी तयार केलेले काल्पनिक प्रश्नपत्रक आहे; अधिकृत परीक्षा नाही."
  },
  "questions": [
    {
      "id": "Q01",
      "topic": "science",
      "parameterizable": false,
      "en": "Which planet is known as the Red Planet?",
      "mr": "लाल ग्रह म्हणून कोणत्या ग्रहाला ओळखले जाते?",
      "options": [
        [
          "A",
          "Venus",
          "शुक्र"
        ],
        [
          "B",
          "Mars",
          "मंगळ"
        ],
        [
          "C",
          "Jupiter",
          "गुरू"
        ],
        [
          "D",
          "Mercury",
          "बुध"
        ]
      ],
      "answer": "B"
    },
    {
      "id": "Q02",
      "topic": "science",
      "parameterizable": false,
      "en": "What is the chemical formula of water?",
      "mr": "पाण्याचे रासायनिक सूत्र काय आहे?",
      "options": [
        [
          "A",
          "CO₂",
          "CO₂"
        ],
        [
          "B",
          "O₂",
          "O₂"
        ],
        [
          "C",
          "H₂O",
          "H₂O"
        ],
        [
          "D",
          "NaCl",
          "NaCl"
        ]
      ],
      "answer": "C"
    },
    {
      "id": "Q03",
      "topic": "geography",
      "parameterizable": false,
      "en": "Which is the largest ocean on Earth?",
      "mr": "पृथ्वीवरील सर्वात मोठा महासागर कोणता आहे?",
      "options": [
        [
          "A",
          "Atlantic Ocean",
          "अटलांटिक महासागर"
        ],
        [
          "B",
          "Indian Ocean",
          "हिंदी महासागर"
        ],
        [
          "C",
          "Arctic Ocean",
          "आर्क्टिक महासागर"
        ],
        [
          "D",
          "Pacific Ocean",
          "प्रशांत महासागर"
        ]
      ],
      "answer": "D"
    },
    {
      "id": "Q04",
      "topic": "mathematics",
      "parameterizable": true,
      "en": "What is {percent}% of {number}?",
      "mr": "{number} च्या {percent}% किती आहेत?",
      "parameters": {
        "percent": [
          10,
          15,
          20,
          25
        ],
        "number": [
          80,
          120,
          200,
          240
        ]
      },
      "options": [
        [
          "A",
          "{wrong1}",
          "{wrong1}"
        ],
        [
          "B",
          "{answer}",
          "{answer}"
        ],
        [
          "C",
          "{wrong2}",
          "{wrong2}"
        ],
        [
          "D",
          "{wrong3}",
          "{wrong3}"
        ]
      ],
      "answer": "B",
      "note": "Template requires a generator to calculate answer and distractors; fixed options are placeholders."
    },
    {
      "id": "Q05",
      "topic": "science",
      "parameterizable": false,
      "en": "Which gas do plants absorb during photosynthesis?",
      "mr": "प्रकाशसंश्लेषणाच्या वेळी वनस्पती कोणता वायू शोषून घेतात?",
      "options": [
        [
          "A",
          "Oxygen",
          "ऑक्सिजन"
        ],
        [
          "B",
          "Carbon dioxide",
          "कार्बन डायऑक्साइड"
        ],
        [
          "C",
          "Nitrogen",
          "नायट्रोजन"
        ],
        [
          "D",
          "Hydrogen",
          "हायड्रोजन"
        ]
      ],
      "answer": "B"
    },
    {
      "id": "Q06",
      "topic": "mathematics",
      "parameterizable": true,
      "en": "A train travels {distance} km in {hours} hours. What is its average speed?",
      "mr": "एक रेल्वे {hours} तासांत {distance} किमी प्रवास करते. तिचा सरासरी वेग किती?",
      "parameters": {
        "distance": [
          90,
          120,
          150,
          180
        ],
        "hours": [
          2,
          3,
          5,
          6
        ]
      },
      "options": [
        [
          "A",
          "{wrong1} km/h",
          "{wrong1} किमी/तास"
        ],
        [
          "B",
          "{answer} km/h",
          "{answer} किमी/तास"
        ],
        [
          "C",
          "{wrong2} km/h",
          "{wrong2} किमी/तास"
        ],
        [
          "D",
          "{wrong3} km/h",
          "{wrong3} किमी/तास"
        ]
      ],
      "answer": "B",
      "note": "Template requires generator to select compatible distance-hours pairs and calculate distractors."
    },
    {
      "id": "Q07",
      "topic": "civics",
      "parameterizable": false,
      "en": "What is the capital of India?",
      "mr": "भारताची राजधानी कोणती आहे?",
      "options": [
        [
          "A",
          "Mumbai",
          "मुंबई"
        ],
        [
          "B",
          "New Delhi",
          "नवी दिल्ली"
        ],
        [
          "C",
          "Kolkata",
          "कोलकाता"
        ],
        [
          "D",
          "Chennai",
          "चेन्नई"
        ]
      ],
      "answer": "B"
    },
    {
      "id": "Q08",
      "topic": "mathematics",
      "parameterizable": true,
      "en": "What is the square root of {number}?",
      "mr": "{number} चे वर्गमूळ किती आहे?",
      "parameters": {
        "number": [
          64,
          81,
          100,
          144
        ]
      },
      "options": [
        [
          "A",
          "{wrong1}",
          "{wrong1}"
        ],
        [
          "B",
          "{answer}",
          "{answer}"
        ],
        [
          "C",
          "{wrong2}",
          "{wrong2}"
        ],
        [
          "D",
          "{wrong3}",
          "{wrong3}"
        ]
      ],
      "answer": "B",
      "note": "Template requires generator to calculate answer and distractors."
    },
    {
      "id": "Q09",
      "topic": "science",
      "parameterizable": false,
      "en": "Which organ pumps blood through the human body?",
      "mr": "मानवी शरीरात रक्त पंप करणारा अवयव कोणता आहे?",
      "options": [
        [
          "A",
          "Lungs",
          "फुफ्फुसे"
        ],
        [
          "B",
          "Liver",
          "यकृत"
        ],
        [
          "C",
          "Heart",
          "हृदय"
        ],
        [
          "D",
          "Kidneys",
          "मूत्रपिंडे"
        ]
      ],
      "answer": "C"
    },
    {
      "id": "Q10",
      "topic": "mathematics",
      "parameterizable": true,
      "en": "A product costs ₹{price}. It has a {discount}% discount. What is the sale price?",
      "mr": "एका वस्तूची किंमत ₹{price} आहे. त्यावर {discount}% सूट आहे. सूटीनंतरची किंमत किती?",
      "parameters": {
        "price": [
          100,
          250,
          400,
          800
        ],
        "discount": [
          10,
          20,
          25,
          30
        ]
      },
      "options": [
        [
          "A",
          "₹{wrong1}",
          "₹{wrong1}"
        ],
        [
          "B",
          "₹{answer}",
          "₹{answer}"
        ],
        [
          "C",
          "₹{wrong2}",
          "₹{wrong2}"
        ],
        [
          "D",
          "₹{wrong3}",
          "₹{wrong3}"
        ]
      ],
      "answer": "B",
      "note": "Template requires generator to calculate answer and distractors."
    },
    {
      "id": "Q11",
      "topic": "computer",
      "parameterizable": false,
      "en": "Which component is commonly called the brain of a computer?",
      "mr": "संगणकाचा मेंदू म्हणून सामान्यतः कोणत्या घटकाला ओळखले जाते?",
      "options": [
        [
          "A",
          "CPU",
          "CPU"
        ],
        [
          "B",
          "Monitor",
          "मॉनिटर"
        ],
        [
          "C",
          "Keyboard",
          "कीबोर्ड"
        ],
        [
          "D",
          "Mouse",
          "माऊस"
        ]
      ],
      "answer": "A"
    },
    {
      "id": "Q12",
      "topic": "mathematics",
      "parameterizable": true,
      "en": "If {a} + x = {total}, what is x?",
      "mr": "{a} + x = {total} असल्यास x ची किंमत किती?",
      "parameters": {
        "a": [
          4,
          7,
          9,
          12
        ],
        "total": [
          15,
          20,
          25,
          30
        ]
      },
      "options": [
        [
          "A",
          "{wrong1}",
          "{wrong1}"
        ],
        [
          "B",
          "{answer}",
          "{answer}"
        ],
        [
          "C",
          "{wrong2}",
          "{wrong2}"
        ],
        [
          "D",
          "{wrong3}",
          "{wrong3}"
        ]
      ],
      "answer": "B",
      "note": "Template requires generator to ensure total > a and calculate distractors."
    },
    {
      "id": "Q13",
      "topic": "energy",
      "parameterizable": false,
      "en": "Which of these is a renewable energy source?",
      "mr": "खालीलपैकी कोणता नवीकरणीय ऊर्जा स्रोत आहे?",
      "options": [
        [
          "A",
          "Coal",
          "कोळसा"
        ],
        [
          "B",
          "Petrol",
          "पेट्रोल"
        ],
        [
          "C",
          "Solar energy",
          "सौर ऊर्जा"
        ],
        [
          "D",
          "Natural gas",
          "नैसर्गिक वायू"
        ]
      ],
      "answer": "C"
    },
    {
      "id": "Q14",
      "topic": "mathematics",
      "parameterizable": true,
      "en": "What is the perimeter of a square with side {side} cm?",
      "mr": "{side} सेमी बाजू असलेल्या चौरसाचा परिमिती किती?",
      "parameters": {
        "side": [
          3,
          5,
          7,
          9
        ]
      },
      "options": [
        [
          "A",
          "{wrong1} cm",